{
  "schema": "rll.observational_topology.v1",
  "version": "20260808.v1",
  "generated_at": "2026-08-08T22:45:00Z",
  "repository": "instituto-Rafael/relativity-living-light",
  "source_main_commit": "13a8227bc28e337be09acf72635a963c3ea26365",
  "append_only": true,
  "claim_allowed": false,
  "publication_ready": false,
  "authority_order": [
    "data/governance/RLL_MODERN_VALIDATION_RECONCILIATION_20260808_V2.json",
    "data/governance/RLL_OPEN_WORK_MECHANISM_REGISTRY_DELTA_20260808_V3.json",
    "docs/real_data/RLL_DESI_DR2_COVARIANCE_BLOCK_AUDIT.md",
    "results/structure_d/joint_real_likelihood_covariance_manifest.json"
  ],
  "state_machine": {
    "fail_closed_default": "TOKEN_VAZIO",
    "states": [
      "MATERIALIZED",
      "VERIFIED_LIMITED",
      "OPEN_INTERNAL",
      "OPEN_EXTERNAL",
      "BLOCKED_DEPENDENCY",
      "INVALIDATED",
      "TOKEN_VAZIO"
    ]
  },
  "invariants": [
    "Ausência, ambiguidade, conflito de autoridade ou covariância incompleta resulta em TOKEN_VAZIO, BLOCKED_DEPENDENCY ou INVALIDATED; nunca em sucesso implícito.",
    "ready_for_joint_inference permanece false para cada nó até que fontes, semântica, covariâncias, nuisances, backend e reprodução sejam demonstrados no mesmo contrato.",
    "Nós de propagação (FRB, RM e B-modes magneto-ópticos) não entram na evidência cosmológica conjunta sem uma previsão física, seleção observacional e likelihood próprios.",
    "A topologia é um overlay append-only: tokens UNBOUND_TOKEN_VAZIO não alteram a contagem, o denominador ou a precedência da fila V4 existente.",
    "Uma contradição entre manifesto operacional e auditoria canônica invalida a promoção do nó até reprodução independente e reconciliação semântica."
  ],
  "nodes": [
    {
      "ready_for_joint_inference": false,
      "current_evidence": [
        {
          "path": "data/governance/RLL_MODERN_VALIDATION_RECONCILIATION_20260808_V2.json",
          "status": "authoritative_reconciliation",
          "note": "Estado reconciliado; não é certificado científico."
        }
      ],
      "id": "MECH-RLL-LINEAR-PERTURBATION-CLOSURE",
      "kind": "mechanism",
      "domain": "theory",
      "observable": "Fechamento linear RLL: delta_s, theta_s, c_s^2, pressão não adiabática, anisotropic stress, Q_mu, gauge, condições iniciais e crossing regularization",
      "state": "BLOCKED_DEPENDENCY",
      "priority": "P0",
      "observation_class": "theory",
      "source_status": "O reconciliador identifica que não há fechamento físico de perturbações suficiente para CMB, crescimento e lenteamento RLL.",
      "token_binding": {
        "mode": "MULTI_SOURCE_GAP",
        "tokens": [
          "TOKEN_VAZIO_RLL_LINEAR_PERTURBATION_CLOSURE",
          "TOKEN_VAZIO_CLASS_CAMB_RLL_IMPLEMENTATION"
        ],
        "queue_effect": "existing_queue"
      },
      "required_gates": [
        "Especificar e implementar o setor perturbativo RLL em gauge declarado.",
        "Validar estabilidade, conservação e condições iniciais contra backend Boltzmann.",
        "Reproduzir observáveis de referência sem trocar o modelo por parametrização efetiva."
      ],
      "dependencies": [],
      "claim_boundary": "Não há predição RLL completa para CMB, fσ8 ou lenteamento enquanto este nó estiver bloqueado.",
      "next_action": "Publicar contrato de perturbações e testes unitários de conservação/estabilidade antes de conectar likelihoods."
    },
    {
      "ready_for_joint_inference": false,
      "current_evidence": [
        {
          "path": "data/governance/RLL_MODERN_VALIDATION_RECONCILIATION_20260808_V2.json",
          "status": "authoritative_reconciliation",
          "note": "Estado reconciliado; não é certificado científico."
        }
      ],
      "id": "MECH-COMMON-LIKELIHOOD-CONTRACT",
      "kind": "mechanism",
      "domain": "theory",
      "observable": "Contrato comum de vetor de dados, covariância, nuisance, prior, escala de corte, backend e recibo de reprodução",
      "state": "TOKEN_VAZIO",
      "priority": "P0",
      "observation_class": "theory",
      "source_status": "Não existe um contrato único que una todas as famílias de dados sem ocultar incompatibilidades de vetor, covariância ou nuisance.",
      "token_binding": {
        "mode": "UNBOUND_TOKEN_VAZIO",
        "tokens": [
          "TOKEN_VAZIO_TOPOLOGY_COMMON_LIKELIHOOD_CONTRACT"
        ],
        "queue_effect": "topology_only"
      },
      "required_gates": [
        "Versionar o schema comum de data vector, covariância, nuisance e prior.",
        "Registrar hashes e semântica de cada bloco antes de qualquer concatenação.",
        "Executar reprodução independente do likelihood conjunto."
      ],
      "dependencies": [
        "MECH-RLL-LINEAR-PERTURBATION-CLOSURE"
      ],
      "claim_boundary": "Resultados de subconjuntos não equivalem a evidência conjunta.",
      "next_action": "Criar o contrato de likelihood e um gate que recuse blocos sem proveniência verificável."
    },
    {
      "ready_for_joint_inference": false,
      "current_evidence": [
        {
          "path": "results/structure_d/joint_real_likelihood_covariance_manifest.json",
          "status": "conflicting_operational_manifest",
          "note": "Declara official_full e pronto para claim."
        },
        {
          "path": "docs/real_data/RLL_DESI_DR2_COVARIANCE_BLOCK_AUDIT.md",
          "status": "canonical_audit",
          "note": "Declara matriz em blocos/local, cross-block oficial não verificado e claim bloqueado."
        },
        {
          "path": "data/governance/RLL_MODERN_VALIDATION_RECONCILIATION_20260808_V2.json",
          "status": "authoritative_reconciliation",
          "note": "Mantém a reprodução oficial do cross-block como TOKEN_VAZIO aberto."
        }
      ],
      "id": "OBS-BAO-DESI-DR2",
      "kind": "observation",
      "domain": "background",
      "observable": "BAO DESI DR2: vetor 13D, blocos BGS/LRG/ELG/QSO/Lyα e pares 2D DM/rd, DH/rd",
      "state": "INVALIDATED",
      "priority": "P0",
      "observation_class": "cosmology",
      "source_status": "Há conflito entre um manifesto que declara covariância joint official_full e uma auditoria que limita o uso à matriz em blocos/local, com reprodução joint pendente.",
      "token_binding": {
        "mode": "BOUND_CURRENT_TOKEN",
        "tokens": [
          "TOKEN_VAZIO_DESI_DR2_OFFICIAL_JOINT_CROSSBLOCK_REPRODUCTION"
        ],
        "queue_effect": "existing_queue"
      },
      "required_gates": [
        "Obter e congelar a fonte oficial do vetor e da covariância joint com semântica de linhas/colunas.",
        "Reproduzir likelihood 13D e pares anisotrópicos com cross-blocks.",
        "Resolver documentalmente a contradição entre manifesto e auditoria antes de qualquer promoção."
      ],
      "dependencies": [
        "MECH-COMMON-LIKELIHOOD-CONTRACT"
      ],
      "claim_boundary": "Nenhum resultado DESI joint, anisotrópico ou de comparação cosmológica pode ser declarado a partir deste nó.",
      "next_action": "Executar a reprodução de referência e substituir o estado INVALIDATED apenas com recibos verificáveis.",
      "contradiction": {
        "conflicting_paths": [
          "results/structure_d/joint_real_likelihood_covariance_manifest.json",
          "docs/real_data/RLL_DESI_DR2_COVARIANCE_BLOCK_AUDIT.md"
        ],
        "resolution_gate": "Reprodução independente do vetor e covariância oficiais, seguida de reconciliação que preserve ambas as evidências anteriores.",
        "safe_interpretation": "Há infraestrutura e blocos locais, mas a equivalência ao likelihood joint oficial não está demonstrada."
      }
    },
    {
      "ready_for_joint_inference": false,
      "current_evidence": [
        {
          "path": "data/governance/RLL_MODERN_VALIDATION_RECONCILIATION_20260808_V2.json",
          "status": "authoritative_reconciliation",
          "note": "Estado reconciliado; não é certificado científico."
        }
      ],
      "id": "OBS-SN-PANTHEON-PLUS",
      "kind": "observation",
      "domain": "background",
      "observable": "Pantheon+: supernovas Ia com covariância estatística e sistemática",
      "state": "VERIFIED_LIMITED",
      "priority": "P0",
      "observation_class": "cosmology",
      "source_status": "O reconciliador registra execução/materialização do caminho Pantheon+, mas não um resultado cosmológico conjunto promovível.",
      "token_binding": {
        "mode": "HISTORICAL_CHAIN_TERMINAL",
        "tokens": [],
        "queue_effect": "historical_only"
      },
      "required_gates": [
        "Conservar o recibo da covariância e da convenção de magnitude/nuisance.",
        "Verificar sobreposição e independência ao combinar com SH0ES.",
        "Integrar somente pelo contrato comum de likelihood."
      ],
      "dependencies": [
        "MECH-COMMON-LIKELIHOOD-CONTRACT"
      ],
      "claim_boundary": "A execução Pantheon+ isolada não resolve H0 nem testa o RLL em evidência conjunta.",
      "next_action": "Adicionar metadados de nuisance e verificação de sobreposição ao contrato comum."
    },
    {
      "ready_for_joint_inference": false,
      "current_evidence": [
        {
          "path": "data/governance/RLL_MODERN_VALIDATION_RECONCILIATION_20260808_V2.json",
          "status": "authoritative_reconciliation",
          "note": "Estado reconciliado; não é certificado científico."
        }
      ],
      "id": "OBS-H0-SHOES",
      "kind": "observation",
      "domain": "background",
      "observable": "Escada de distância SH0ES: Cefeidas e SNe Ia",
      "state": "OPEN_INTERNAL",
      "priority": "P0",
      "observation_class": "cosmology",
      "source_status": "A fonte primária foi rastreada, mas a integração com inferência H0-rd de backend Boltzmann permanece aberta.",
      "token_binding": {
        "mode": "BOUND_CURRENT_TOKEN",
        "tokens": [
          "TOKEN_VAZIO_H0_RD_FULL_BOLTZMANN_INFERENCE_INTEGRATION"
        ],